category,text,label,node_id,neighbour
Literature & Fiction,"Description: Two decades before the Civil War, an eight year- old Southern heiress longs for the love of the father she has never known--but when they meet at last, nothing is as Elsie expects. Can the proud and willful Horace Dinsmore learn to love his only child--a little girl whose first allegiance is to God? Introducing soft cover editions in the Elsie Dinsmore Series with newly designed covers.Martha Finley (1828 - 1909) was a remarkable woman whose quiet Christian life has influenced many. A teacher by profession, her writing career began wih Sunday school stories for children. In 1868, her novel Elsie Dinsmore was published and became the publisher's best-selling book that year, spawning a series that sold millions of copies at home and abroad. The Millie books were a follow-up to that series.; Title: Elsie's Stolen Heart (Life of Faith, A: Elsie Dinsmore Series)",0,73342,"[73320, 73321, 73324, 73326, 73327, 73328, 73333, 73336, 73339]"
Education & Reference,"Description: DK was founded in London in 1974 and is now the world's leading illustrated reference publisher and part of Penguin Random House, formed on July 1, 2013. DK publishes highly visual, photographic nonfiction for adults and children. DK produces content for consumers in over 87 countries and in 62 languages, with offices in Delhi, London, Melbourne, Munich, New York, and Toronto. DK's aim is to inform, enrich, and entertain readers of all ages, and everything DK publishes, whether print or digital, embodies the unique DK design approach. DK brings unrivalled clarity to a wide range of topics with a unique combination of words and pictures, put together to spectacular effect. We have a reputation for innovation in design for both print and digital products. Our adult range spans travel, including the award-winning DK Eyewitness Travel Guides, history, science, nature, sport, gardening, cookery, and parenting. DKs extensive childrens list showcases a fantastic store of information for children, toddlers, and babies. DK covers everything from animals and the human body, to homework help and craft activities, together with an impressive list of licensing titles, including the bestselling LEGO books. DK acts as the parent company for Alpha Books, publisher of the Idiot's Guides series and Prima Games, video gaming publishers, as well as the award-winning travel publisher, Rough Guides.; Title: My First Spanish Word Board Book/Mi Primer Libro de Palabras en Espanol (My First series)",12,35322,"[3954, 5402, 5483, 6901, 7650, 9724, 9727, 9732, 9758, 9850, 10007, 10031, 10587, 10924, 12820, 12867, 13124, 15166, 15796, 16264, 16538, 20204, 21002, 23727, 23944, 28299, 28352, 28353, 29142, 30828, 30883, 33314, 34538, 34545, 41044, 41246, 43719, 44114, 44117, 44807, 45686, 56681, 70677, 71097, 71163]"
Growing Up & Facts of Life,"Description: Praise forTime Out: ""Barbasartwork weds Miros palette to James Marshalls glee, and her bold black lines are fueled by imaginative power.""--Publishers Weekly, starred review""Totally fun, visually startling, and a paean to creative thinking.""--Kirkus ReviewsPraise for When Your Elephant Comes to Play:""An excellent addition to any collection, this appealing tale is full of humor and easily extends imaginative play.""--Kirkus""Astory as irrepressible as the cross-species pals it stars.""--Publishers Weekly""A pleasant read about a little boys big imagination, with creative, colorful spreads that will stay with readers long after the story ends.""--Booklist""A fun addition for picture book collections."" --School Library JournalAle Barba (www.AleBarba.com)has been making art with a variety of mediums for as long as she can remember. She has been published in the Spanish language in Mexico, Denmark, and Colombia, and her work has twice been recognized by the National Council for Culture in Mexico. She is also the author of When Your Elephant Comes to Play, which was her U.S., English-language debut. Ale lives in Guadalajara, Mexico.; Title: Time Out!",2,15757,"[20810, 20824, 45252, 55159, 68210]"
Growing Up & Facts of Life,"Description: Robert Neubecker is the author and illustrator of the acclaimed WOW! books, which include Wow! City!, Wow! School!, and Wow! Ocean!, as well as the illustrator of John Lithgow&#8217;s I Got Two Dogs and Sarah Weeks&#8217;s Sophie Peterman Tells the Truth. His books have been named ALA Notable Books, and his work is often included in the Society of Illustrators Original Art Show. Robert is also a regular contributor to many national media publications, including the New York Times, Slate.com, and the Wall Street Journal.; Title: What Little Boys Are Made Of",2,3010,"[2710, 14695, 29922]"
"Science, Nature & How It Works","Description: Grade 2-4?In this photo-filled nature book, children get a grand picture of the largest living trees in the world. Wadsworth provides a sharply focused and visually captivating portrayal of the parts, the environment, the life cycle, and the death of a sequoia. The clear, full-color photographs provide graphic illustration of the size and complexity of these mammoth trees. Through simple but carefully constructed explanations, the interconnected nature of the plants, animals, and natural events (forest fires, precipitation, etc.) that allow the sequoias to continue to prosper give useful insights into their future survival. Adults will appreciate the ""On Sharing a Book"" section, a feature of this series, which gives hints about how to use the book effectively with children.?Steve Matthews, Foxcroft School, Middleburg, VACopyright 1995 Reed Business Information, Inc.; Title: Giant Sequoia Trees (Early Bird Nature Books)",15,38843,"[42564, 65102]"
Education & Reference,"Description: ""I highly recommended this book to be part of all pediatric speech-language pathologists therapy materials. It is also perfect for parents of children working on developing their early words.""Cara Tambellini Danielson is a California licensed Speech-Language Pathologist. She holds a Certification of Clinical Competence from the American Speech-Language Hearing Association (ASHA). She received her B.A. from Northwestern University and her M.A. in Communication Sciences and Disorders from Northwestern University. Cara specializes in pediatric speech and language development. She has experience working in a variety of settings, including private practice, early intervention, schools, and rehabilitation hospitals. She currently lives in Santa Monica, California.; Title: Easy-To-Say First Words: A Focus on Final Consonants",12,56608,"[9676, 9696, 9802, 9806, 9822, 13450, 14557, 25966, 28524, 30890, 31262, 32828, 38301, 44750, 52565, 54607, 57095, 74895, 75049]"
Literature & Fiction,"Description: Grade 4-6. A new entry in a series of Christian fiction that places a young protagonist in the path of a heroic person who has made the world a better place. The horrors of war and disregard for the common soldier underlie this story of two brothers who leave home out of financial necessity to join the British forces fighting the war in Crimea. The older brother dies in the hopeless charge of the Light Brigade. Robby, the younger sibling, has his hand amputated by an unconcerned doctor in a filthy field hospital. The boy is placed in service to Florence Nightingale and becomes devoted to her, admiring her determination, courage, and self-sacrifice. The descriptions of war and its results are vivid. The main characters are engaging, and the historical background is accurate and informative. Villains abound, and they're not on the Russian side in this war. Readers of Patricia Beatty or G. Clifton Wisler's historical novels will be drawn to this title. Unfortunately, the amateurish drawings will limit the audience, and the five-title list for further reading contains one book from 1946 and another from 1951. Too bad, because this is a worthwhile, entertaining adventure story with universal values and appeal.?Marlene Gawron, Orange County Library, Orlando, FLCopyright 1997 Reed Business Information, Inc.Dave and Neta Jackson are a full-time husband/wife writing team who have authored and co-authored many books on marriage and family, the church, relationships, and other subjects. Their books for children include the TRAILBLAZER series and Hero Tales, volumes I,II, III, and IV. The Jacksons make their home in Evanston, Illinois.; Title: The Drummer Boys Battle: Florence Nightingale (Trailblazer Books #21)",0,60050,"[594, 60009, 72006]"
Growing Up & Facts of Life,"Description: Gr 47Two stories of loss collide in this work of realistic fiction. Zavion and his father lose their house and everything they own in Hurricane Katrina. Zavion's already experienced the death of his mother, and he has created a personal code of conduct to help him survive. After he and his father take food from an abandoned convenience store in New Orleans, Zavion believes he has a debt to pay. That's going to be hard to do from Baton Rouge, where he and his father have relocated. Meanwhile, in Vermont, Henry is dealing with sudden death of his friend Wayne. Henry was with Wayne at the time, but the memories of the event are too painful for him to recall. The two boys passed a special marble back and forth for good luck for years. When Henry's mother donates some of his clothes to victims of Hurricane Katrina, she accidentally gives away the marble, which becomes the catalyst for merging the two plots, with Henry making his way to New Orleans in hopes of finding it and Zavion hatching his own plan to travel to the city to pay his debt. Smith excels at capturing the urgency of crisis, and strong, fast-paced openings of both plotlines pull readers right into the story. While the narrative is based on coincidence and chance, the voices and losses of Zavion and Henry are plausible and heartbreaking. Less believable are the many minor characters in the book, who are difficult to keep track of and who are sometimes inserted without context. However, the disorientation this creates is not entirely out of place here, since the novel mirrors the characters' feelings and experiences. The author is at her best when she conveys emotionally charged moments, with the prose reminiscent of a free verse poem; a particularly memorable moment involves the two main characters literally running into each other. It is refreshing to see the feelings of two middle grade boys explored so fearlessly. VERDICT This is a novel that will spark contemplation and discussion.Juliet Morefield, Multnomah County Library, ORElegant prose and emotional authenticity will make this title sing not only for those who have experienced tragedies, but for everyone who knows the magic that only true friendship can foster.Kirkus Reviewsstarred review; Title: Another Kind of Hurricane",2,23805,"[6553, 6584, 6829, 10343, 19359, 22104, 22834, 25579, 28408, 51565, 52800]"
Religions,"Description: The publication of commentaries for children on neglected biblical books such as Exodus and Leviticus is noteworthy in itself. Christians have for too long starved their children of much of the nourishment of that Word which is 'all... profitable'. But Nancy Ganz's 'Herein is Love' series is very much more. Here, in fact, is a biblical theology, a re-telling of these ancient writings in the light of the whole Bible and with a firm grasp of its central thrilling theme - the redeeming love of God in Christ. --Professor Ted Donnelly, President, Reformed Theological College, Belfast; Title: Herein Is Love, Vol. 3: Leviticus",20,43120,"[5412, 22950, 43118, 62259, 63231, 72391, 73516, 73523]"
"Science, Nature & How It Works","Description: For decades, Laura Bush has championed key issues in the fields of education, health care, human rights, and the preservation of our nation&#8217;s heritage. A hiking and outdoors enthusiast, Mrs. Bush encourages Americans to spend time in and care for our national parks.The author of the bestselling memoir Spoken from the Heart, Mrs. Bush also founded both the Texas Book Festival and the National Book Festival in Washington, DC. Today, as the chair of the Women&#8217;s Initiative at the George W. Bush Institute, Mrs. Bush continues her work on global health-care innovations, empowering women in emerging democracies, education reform, and supporting the men and women who have served in America&#8217;s military.&#160;Mrs. Bush holds a degree in education and a master&#8217;s degree in library science. She taught in public schools in Dallas, Houston, and Austin and worked as a public school librarian.; Title: Our Great Big Backyard",15,4245,"[1293, 1294, 2436, 2531, 3443, 3600, 4157, 4227, 4379, 4392, 6433, 9443, 11931, 13073, 13153, 13164, 14599, 14995, 15161, 15285, 16558, 18771, 18888, 19646, 20338, 22672, 24880, 26973, 28025, 28141, 28302, 28810, 31209, 32028, 32089, 32304, 33185, 36570, 38330, 39755, 41672, 43598, 44727, 44753, 45991, 49427, 49908, 50329, 52563, 52663, 54786, 57337, 57873, 58162, 58301, 63184, 64107, 68204, 68778, 69400, 71778, 72774, 74411]"
"Science, Nature & How It Works","Description: Detailed yet accessible text begins with ""electrons on the move"" and explains how electricity is generated at a power plant and travels across wires to brightly lit homes. Suen also covers how interior wiring, breakers, switches, and outlets work. Illustrated with multimedia artwork with a 3-D effect, the book concludes with electricity safety tips.-Book Links November 1, 2014Raising the awareness of any reader who's ever switched on a light or wondered what those wires above the street are, Suen traces the long ""dance"" of electrons from a (water-driven) generator to a home's plugs, lamps and computer screens. Linked by lines of poem -- ""Humming, thrumming, / power's coming / in the wires / from big to small / to power it all"" -- her commentary offers simple but specific descriptions of how, for instance, step-up and step-down transformers work, what ground wires and circuit breakers do and even what's behind those ubiquitous switch plates. With help from occasional discreet labels, Carrick's realistic, low-relief collages follow wires over transmission towers and wooden poles, down through electric meters and cutaway walls. Suen closes with a list of safety tips and, for children curious about topics she doesn't cover, such as difference between volts and amps, or AC and DC, a handful of print and online resources. Audiences who find Joanna Cole's Magic School Bus and the Electric Field Trip, illus by Bruce Degen (1997), too busy to absorb may come away from this more linear approach with a clearer idea of what powers their everyday infrastructure.-Kirkus Reviews - June 15, 2007 This introduction to electricity traces the path of electrons from the power station to electronic devices used in the home. A series of spreads with a few paragraphs of text describes each stage along the way. This progression works well, covering the physical implements and machines as well as general scientific concepts. The important role of transformers, for example, emerges in a logical way, reinforcing the key concept that electricity is an energy that can be controlled and guided. Acrylic mixed-media illustrations are informative, with clear labels to identify specific components. The uncrowded layout and three-dimensional look are especially effective. Each spread leads neatly into the next one, so the visual flow is uninterrupted. Readers see wires reaching the electric meter, then a page turn shows that meter close up, while the subsequent spread reveals the inside wires moving out from the meter. A few descriptions are oversimplified, but a glossary fills in needed details. Joanna Cole's The Magic School Bus and the Electric Field Trip (Scholastic, 1997) and Barbara Seuling's Flick a Switch (Holiday House, 2003) cover more ground, and Molly Bang's My Light (Scholastic, 2004) is more visually dazzling, but this title succeeds with its carefully focused approach. By sticking consistently to the topic of how electricity reaches the home without trying to cover history, trivia, or more complex science, the fundamental information comes through in an appealing way that kids can fully understand.-School Library Journal - July 1, 2007 In this picture book for elementary students, Suen covers the basics of how electricity moves from power plant to cozy, lamp-lit home. The text works on two levels. Each spread features short paragraphs that present definitions in clear language: ""Electricity is electrons on the move."" A few words, in larger print, appear on each page, and when read aloud create a bouncing rhyme that seems aimed at children younger than the audience for the science and the pictures. The mixed-media art illustrates the concepts with mixed success. Some spreads, such as one explaining how power is ""stepped down"" at a transformer, need more detail to help kids full envision what the words describe. Most successful are the scenes of long lines reaching across landscapes, demonstrating that power is generated far away and travels great distances before it is used. There aren't many titles that explain electricity for this age group; recommend this one with some of the other books in the appended reading list. A glossary and power safety tips conclude.Booklist - August 1, 2007Anastasia Suen is the author of dozens of books for young readers, including SUBWAY (Viking) and RED LIGHT, GREEN LIGHT (Harcourt). She lives in Plano, Texas.; Title: Wired",15,61244,"[4907, 11351, 14339, 21847, 23969, 24328, 27752, 34017, 45552, 45834, 49728, 49935, 52404, 55905, 58181, 59855, 65174, 68207, 69868]"
Comics & Graphic Novels,"Description: ""The campy, cool interpretation of the caped crusader from the ever-popular television show elicits all sorts of emotions from comic book readers: from embarrassment to pure joy...""--Comic Book Resources""Even if you aren't a fan of the classic TV show, you'll have a good time here. It's a blast from start to finish.""--IGNJeff Parker is a Portland, Oregon based writer and comic book artist. He worked as a storyboard artist on the television cartoon ""Big Guy and Rusty the Boy Robot,"" and has written a number of Marvel Comics titles including, X-Men: First Class, Agents of Atlas, and Thunderbolts, as well as AQUAMAN and BATMAN '66 for DC Comics. He is a member of Periscope Studio, originally from Burlington, North Carolina, and the son of a grocery store owner. His first exposure to comics came from reading comics on the store's spinner racks.; Title: Batman '66 Vol. 4",22,46132,"[46127, 46128, 46134, 46141, 46144]"
Growing Up & Facts of Life,"Description: After the passing of Proposition 8 in California, Eric began to devote the majority of his free time to working towards LGBT equality. He is currently a local chapter leader for Marriage Equality USA where he continues to educate the public on the importance of marriage equality and the 1,000+ rights that are denied to same-sex couples. Eric is the author of My Uncles Wedding, a childrens book about same-sex marriage published in 2011. He currently lives with his husband, Mat, and their two cats in Emeryville, CA. Visit www.MyUnclesWedding.com for more information.; Title: My Uncle's Wedding",2,52855,"[10339, 10443, 16468, 16572, 16734, 32071, 33863, 36509, 36639, 52436, 52667, 57079, 62655, 62676, 66919, 67163, 71025, 74907]"
Geography & Cultures,Description: S Is for Seattle; Title: S is for Seattle (Alphabet Places),11,75133,"[19379, 42993, 44071, 49425, 49427, 61170, 61185, 61188, 63095, 66048, 66066, 68997, 69009, 69010, 69012, 74724, 74781, 75134, 75369]"
"Arts, Music & Photography","Description: Twin Sisters Productions is a leading producer of educational music resources for children and families. The award-winning product line includes lullabies, classical music, original relaxation music, preschool and early childhood learning, reading readiness, math, foreign languages, social studies, science, musical plays for the classroom, inspirational music...and more.; Title: States &amp; Capitals Workbook",13,61775,"[69957, 71755]"
Education & Reference,Description: JULIE HARPER WORKBOOKSWhich workbook is right for you?; Title: Printing Practice Handwriting Workbook for Boys,12,57092,"[8210, 31303, 34549, 42483, 48733, 53153, 53828, 53976, 54191, 55686, 55737, 55741, 56227, 56722, 57761, 58040, 69746, 69784, 69984, 74331, 74336]"
Growing Up & Facts of Life,"Description: White Flight is young adult novel in verse. Through 82 interconnected open form poems, Alex tells the story of his slowly deteriorating neighborhood, and of his struggle with his crushing secret: the brutal shooting death of his best friend, Daryl. Alex also reflects on the issues of white flight, urban police, sexual harassment, and the no-snitch culture.; Title: White Flight: A Novel in Verse",2,59116,"[6905, 21698]"
"Arts, Music & Photography","Description: PreSchool-Grade 3-More a celebration of sound than a story, this upbeat picture book explores 10 different types of music. The young African-American narrator introduces each member of her extended family and the style of music he or she plays, from blue grass to marching band to rock 'n' roll to church hymns. As different as these genres are, this girl can always play along with each of her relatives, keeping the beat with an appropriate percussion instrument, including the cymbals, a cowbell, and maracas. Finally, she joins her young niece on the floor to drum on pots and pans. A glossary defining all the musical terms and genres appears on the last page. The cut-paper illustrations are vibrant and filled with energy. The bright reds, sunny yellows, and deep blues are similar in palette to Synthia Saint James's artwork. Pair this title with Lloyd Moss's Zin! Zin! Zin! A Violin (S &amp; S, 1995) for a fun and useful introduction to music.Jane Marino, Bronxville Public Library, NYCopyright 2003 Reed Business Information, Inc.PreS-Gr. 1. This is a good year for books about music, including Aliki's Ah, Music! [BKL Je 1 &amp; 15 03] and this charmer about a family of music makers. The young female narrator starts off describing a page of pictures of her family. ""We all love music,"" she says, and the images include those of instruments as well as of musicians. Her mom plays fiddle in a country band, and the girl plays the tambourine. Her dad plays cello in a string quartet, and she plays the triangle. And so it goes throughout the family: her sister plays a clarinet in the marching band, and she plays the cymbals; her brother plays lead guitar in a rock-'n'-roll band; her grandma plays bluegrass banjo and her grandpa the polka tuba. The paper-cut illustrations vibrate with color and--almost--with sound. The multiracial family with its rainbow of skin tones is not only a lovely multicultural statement but also a vivid reflection of contemporary families and musical tastes. GraceAnne DeCandidoCopyright American Library Association. All rights reserved; Title: My Family Plays Music (CORETTA SCOTT KING/JOHN STEPTOE AWARD FOR NEW TALENT ILLUSTRATOR (AWARDS))",13,39189,"[5385, 6895, 10443, 21173, 21372, 25368, 26995, 32740, 36307, 45827, 48631, 51730, 51851, 52599, 59399, 65041]"
Religions,"Description: The haggadah like you've never seen it, as silly as it is reverent, as traditional as it is new. -- Los Angeles TimesThis is the book to buy for all the kids coming to your seder this year -- Jewish World News, National Jewish Post and Opinion, March 1999This is the book to buy for all the kids coming to your seder this year. -- Jewish World News, National Jewish PostThis special-for-kids, most fun ever Haggadah lives up to its name. -- Hadassah MagazineUncle Eli's Special-for-Kids' is the haggada like you've never seen it, as silly as it is reverent, as traditional as it is new -- Los Angeles Times, March 1999Wacky and amusing..., with a non-conventional bent that only adds to its effectiveness. -- Calgary Jewish Free PressWith Dr. Seuss-style verse, the haggadah speaks to children in their own language. -- B'nai B'rith International Jewish MonthlyEliezer Segal holds a Ph.D in Talmud from the Hebrew University of Jerusalem and serves as Professor of Religious Studies at the University of Calgary. He is committed to bringing the fruits of academic research to wider audiences through his popular newspaper columns in the Calgary Jewish newspapers. He is married to Agnes Romer Segal and is father to three boys.; Title: Uncle Eli's Passover Haggadah",20,72521,[62166]
"Fairy Tales, Folk Tales & Myths",Description: Greek Myths for Young Children; Title: Greek Myths for Young Children (Stories for Young Children),5,30379,"[8645, 10091, 14291, 15249, 15260, 15291, 17670, 19310, 21424, 26155, 27426, 27771, 29012, 30409, 30959, 32539, 32571, 34239, 35685, 40814, 41916, 47356, 47518, 49624, 49629, 49690, 49783, 49872, 49973, 51844, 52692, 53199, 57337, 58010, 58047, 60969, 61984, 61987, 62003, 62007, 62513, 63874, 63878, 64918, 67160, 68125, 69804, 70900, 72394]"
