category,text,label,node_id,neighbour
Literature & Fiction,Description: A third grade home school reading book. Stories are based upon Immigrants from Norway in 1820 America.; Title: Secrets in the Maple Tree,0,76634,[41924]
Education & Reference,"Description: Baby Professor showcases a collection of subjects that are educational for kids to help them learn how to do something themselves, exactly how something is done or how it came about. Children love to learn through attractive visuals and Baby Prof. is ideal to get your child the head start he or she needs for the future. Our Motto - ""Learning is Fun, so let's Make it Fun to Learn"".; Title: The Best Spanish Learning Games for Children | Children's Learn Spanish Books",12,58818,"[9850, 10587, 12820, 58871, 73447]"
Literature & Fiction,"Description: Being a princess is not all glittery parties and lavish holidays by the sea. Well, actually, it is, but it's not all fun. Young Princess Victoria is constantly surrounded by family and advisors, allowing her no privacy and very few opportunities to express herself until she purloins an old ledger book from one of Kensington Palace's stables. She promptly begins recording her secrets, daily trials, and naughty witticisms (her uncle, King George IV, has big, plump hands, ""the size of a plucked quail."") in this very incongruous journal. The biggest secret of all, however, is one that is kept from our heroine. It is not until well into her two-year-long diary that Victoria pieces together her family tree to discover that she is next in line to the throne. This intriguing installment of the Royal Diaries series will inspire many readers to delve deeper into Queen Victoria's life as the longest reigning queen of England. Author Anna Kirwan's fictionalized account is entertaining and enlightening, packed with facts about royal customs in the early 19th century. Historical notes, a family tree, and photos provide more factual information for the curious reader. (Ages 9 to 12) --Emilie CoulterGr 4-7-A charming portrayal of three years in the childhood of Queen Victoria. The nine-year-old begins by confessing that she stole a livestock ledger from the stable in order to have a journal in which to write her private thoughts. She fills the pages with details of life in Kensington Palace, from the menu at breakfast, her daily lessons and tutoring sessions to a ball given by her uncle the King, a vacation by the sea, and the negative influence of Captain Conroy, one of her mother's advisers. Throughout, the princess exhibits a shrewd awareness of palace life and a growing sense of the larger role she is being prepared for and must shortly assume. An epilogue reveals that Victoria became Queen just after her 18th birthday. While at first the young princess's voice appears a bit mature, as readers learn more about her demanding education and extraordinary upbringing, she becomes more plausible. A historical note, photographs, a family tree, and a glossary of characters round out the novel. Fans of the series will be delighted.Kristen Oravec, Cuyahoga County Public Library, Strongsville, OHCopyright 2002 Cahners Business Information, Inc.; Title: The Royal Diaries: Victoria, May Blossom of Britannia, England 1829",0,17160,"[16961, 16980, 16989, 17033, 17034, 17042, 17043, 17055, 17109, 17112, 17125, 17134, 17136, 17156, 17161, 17170, 17176, 17196, 17197, 17383, 17442, 17927, 22112, 22143, 22162, 22167, 22223, 24174, 24476, 24517, 48225]"
Animals,"Description: PreSchool-K&mdash;Cat the Cat visits her friends, asking them to make their sounds. The dog woofs, the chick peeps, the cow moos, but the bunny is silent. As Bunny the Bunny makes no response, the others look at him with sympathy and say in unison, ""sounds like&hellip;somebody needs a hug!"" On the one hand, the message seems to be that even if you are different, your friends still love you. On the other hand, an underlying message is that if you are different, your friends will feel sorry for you. Not quite the same as celebrating the differences. The illustrations are characteristically spare with flat, unshaded colors outlined in black. Repeated use of a pale green background on each spread ties the whole book together nicely. Using few words, Willems relies on facial expressions and body posturing to convey humor with minimal detail. Making the animal sounds concept more interesting is a secondary story line: the animals are all preparing for a tea party. Cat the Cat gaily carries a basket covered with a checked napkin as she visits each animal who in turn is preparing something to share at the party. Willems does almost everything right. Children will enjoy making animal sounds and will laugh at his silly humor. But the underlying message that differences may elicit pity is an unfortunate flaw that keeps this book from being a winner.&mdash;Mary Hazelton, Elementary Schools in Warren &amp; Waldoboro, ME (c) Copyright 2010. Library Journals LLC, a wholly owned subsidiary of Media Source, Inc. No redistribution permitted.Mo Willems knows a Good Idea when he sees one. A three-time Caldecott Honor winner (for Don&#39;t Let the Pigeon Drive the Bus!, Knuffle Bunny, and Knuffle Bunny Too), he also won two Geisel Medals and two Geisel Honors for his Elephant and Piggie books. His books are perennial New York Times bestsellers, including Knuffle Bunny Free, Hooray for Amanda &#38; Her Alligator!, and the Cat the Cat series. Before he turned to making picture books, Mo was a writer and animator on Sesame Street, where he won six Emmys. Mo lives with his family in Massachusetts.; Title: What's Your Sound, Hound the Hound? (Cat the Cat Series)",1,2680,"[2661, 2664, 2665, 2828, 2959, 3205, 3350, 3692, 3701, 3702, 3764, 15096, 19306, 21759, 25966, 26566, 34887, 34950, 34954, 34970, 34976, 45991, 46000, 48908, 48962, 48996, 48998, 49001, 49003, 49023, 49042, 49086, 49088, 49091, 49131, 49138, 49193, 49257, 49259, 49267, 49304, 51597, 54975, 55832, 55840, 55846, 55852, 55861, 55869, 55875, 55884, 55896, 55930, 68210]"
Literature & Fiction,"Description: History comes alive for eight-to-twelve year olds in this close-up, fun-to-read, multi-generational story of a fictional family spanning three centuries of actual historical events. God's hand is seen at work in people's lives and in the events that shaped our nation.; Title: Dream Seekers: Roger William's Stand for Freedom (The American Adventure Series #3)",0,61891,"[4437, 61874, 61875, 61876, 61877, 61878, 61879, 61880, 61882, 61883, 61885, 61886, 61887, 61888, 61894, 61895]"
Biographies,"Description: Clayton Geoffreys was born and raised in Norwalk, Connecticut. Growing up, Clayton could often be found spending afternoons reading in the local public library about management techniques and leadership styles, along with overall outlooks towards life. It was from spending those afternoons reading about how others have led productive lives that Clayton was inspired to write this book. Usually Clayton write works around sports to learn more about influential athletes in the hopes that from his writing, you the reader can walk away inspired to put in an equal if not greater amount of hard work and perseverance to pursue your goals. If you are a sports junkie like Clayton, you can read his sports-related works on Steve Nash, Stephen Curry, Vince Carter, Hakeem Olajuwon, John Wall, Russell Westbrook, Tim Duncan, Reggie Miller, Allen Iverson, and Karl Malone. Clayton also wrote 88 Productivity Hacks: Key Habits on How to Beat Stress, Achieve Goals, and Live a Fulfilling Life, which can also be found in the Kindle Store.; Title: Kevin Love: The Inspiring Story of One of Basketball's Dominant Power Forwards (Basketball Biography Books)",17,57168,[54032]
"Activities, Crafts & Games","Description: For more than 20 years I was a teacher in Thailand, my home country, and devoted myself to my students and other teachers, whom I trained. It was only when I had my own family that I began to think about the education of my own child. Our son was introduced to books from a very early age and he was also lucky to grow up in a household where reading was a favoured pastime and books were everywhere. In his early years we read to him daily from the array of picture and story books which we bought; and even now, he still loves reading. This experience inspired me to write and illustrate a bilingual (Thai and English) childrens book. My aim for JJ A Curious Boy is not just to provide something for children to read for pleasure, but also to provide a useful resource to preserve the Thai language while at the same time supporting the development of English language skills amongst Thai children.; Title: JJ &ndash; A Curious Boy (Thai Edition)",6,57087,"[32301, 36707, 51101, 56672, 73978]"
Growing Up & Facts of Life,"Description: PreS-K--This lovely and soothing book begins when the sun sets and the night emerges. Mom and son go for a walk and say hello to everything who passes the stroller on their way. They greet the night, the owl, the cricket, the stars, and many other things. Their walk ends when they arrive home and greet the bed and the boys duckie pajamas, as he gets ready for sleep. He happily welcomes the night and enjoys his slumber. In the vein of &#34;Goodnight Moon&#34;, this is a perfect bilingual book to rock a child to sleep. Its soft, dreamlike acrylic illustrations are inviting, and the brief rhyming sentences flow across the artwork. Even the most stubborn child is sure to welcome bedtime after listening to this story. Recommended for libraries and bookstores. -- Criticas; Title: Hello Night/Hola Noche Bilingual (Multilingual Edition)",2,41056,[21002]
Literature & Fiction,"Description: Enjoyable. -The Horn BookDavid A. Adler lives in Woodmere, New York. Barbara Johansen Newman lives in Needham, Massachusetts.; Title: Bones and the Dog Gone Mystery",0,6268,"[566, 673, 1393, 1728, 2372, 2426, 3443, 3446, 4722, 4733, 4739, 4747, 4756, 4793, 4807, 5294, 5313, 5570, 5614, 5647, 5672, 5728, 5865, 5902, 5947, 6007, 6016, 6049, 6059, 6140, 6242, 6258, 6293, 6349, 6410, 6458, 6471, 6566, 6583, 6722, 10583, 12641, 13759, 13890, 15198, 15203, 17980, 18017, 18022, 18072, 18082, 18164, 18198, 18203, 18218, 18706, 18891, 18993, 19175, 19210, 19345, 20300, 26383, 27364, 27372, 27593, 27780, 29006, 33088, 49977, 54672, 56791, 56823, 58990, 61712, 61739, 69512]"
"Science, Nature & How It Works","Description: You will get the chance to join your kids in reading and learning with our educational and informative books.; Title: The Moon, the Sun and the Constellations- Beginner's Astronomy Lessons for Kids - Children's Astronomy &amp; Space Books",15,70149,[69935]
Literature & Fiction,"Description: Grade 1-5&ndash;Based on an ancient legend, this story tells of a young man who is sent to find buffalo. Through a dream/vision, he saves the Cree people from starvation by actually finding the animals when it seemed there would be none to provide for winter survival. Told in the quiet, spare style of many Native American tales, this story stays calm even in the face of great trouble. The illustrations of the prairie beautifully capture the light and feel of the region in fall. Immediacy is retained by the use of the present tense throughout the book. Full-page layouts increase the sense of open space, although the text is difficult to read when it is placed on darker colors. Used as a read-aloud, this title provides an evocative introduction to the life on the plains and the ways of these people.&ndash;Cris Riedel, Ellis B. Hyde Elementary School, Dansville, NY Copyright &copy; Reed Business Information, a division of Reed Elsevier Inc. All rights reserved.Gr. 1-3. The Cree people have not seen buffalo all summer. Now in the Moon of Changing Leaves, the people must find the herds if they are to have food for the winter. After discovering a white stone in the shape of a buffalo, young Sky Running dreams of great buffalo herds in enemy territory known as the Badlands. Despite the danger, his tribe sets off toward the buffalo, never encountering the enemy but eventually finding vast herds of the animal. The colorful, double-page paintings by Native American artist Lonechild are especially effective when showing the landscapes of the northern Plains and the haunting Badlands region. Skillfully told and illustrated, this memorable tale is based on a traditional Cree story about the power of prayers and dreams to ensure people's survival. Karen HuttCopyright &#169; American Library Association. All rights reserved; Title: Hidden Buffalo (Northern Lights Books for Children)",0,41818,"[44562, 59610, 73227]"
Animals,"Description: &#8220;Fun, factual, and fabulously photographed, Curious Critters demonstrates the important role of literature in helping young readers connect with nature.&#8221; &#8212;Richard Louv, author of Last Child in the Woods and The Nature Principle David FitzSimmons&#160;is an award-winning photographer and writer. His Curious Critters children&rsquo;s picture books--Curious Critters,&#160;Curious Critters Volume Two, and&#160;Curious Critters Marine--have won numerous national book awards and have sold over 100,000 copies. A Sigma Pro photographer, David presents seminars and workshops across North America to a wide variety of audiences. He holds a Ph.D. in English from Ohio State, with a specialty in narrative theory. A life-long educator, David frequently visits schools to talk about connecting children and nature.&#160;He lives in Bellville, OH.; Title: Curious Critters Missouri (Curious Critters Board Books)",1,74463,[74462]
Literature & Fiction,"Description: Gr. 3-5. Through the 1848 journal of nine-year-old Joshua McCullough, readers come face-to-face with the rigors of the wagon-train trek from St. Joseph, Missouri, to the Oregon Territory. Joshua shares the daily routines of wagon train travel, making real the everyday annoyances as well as the life-threatening dangers that are part of the trip. Washing away trail dust that cakes animals' eyes shut, pitching in to replace another family's possessions that spilled into a river, burying those who die along the way from illness or wagon accidents are among the events recounted in Joshua's simply penned, yet compelling entries. This perceptive boy senses a mother's pain over the loss of her children on the trail and, despite others' mistrust and fear, observes, ""Indians are a lot like the rest of us."" This entry in the My America series will stick in readers' minds and enrich their studies of the era. Ellen MandelCopyright American Library Association. All rights reserved; Title: My America: Westward To Home: Joshua's Oregon Trail Diary, Book One",0,17033,"[1946, 2565, 2948, 5303, 5338, 5508, 5977, 11661, 16970, 16985, 17002, 17004, 17020, 17025, 17049, 17087, 17096, 17102, 17131, 17144, 17160, 17176, 17195, 17316, 18432, 19127, 19356, 22370, 24174, 24243, 24258, 24263, 24320, 24515, 26380, 26419, 27196, 27234, 30692, 45726]"
Growing Up & Facts of Life,"Description: Grade 5-8In this fourth installment featuring the Casson family, McKay's strong points shine through. Though it takes much of the book to get there, the climactic event is the (attempted) marriage of oldest sister, Caddy, to someone other than Darling Michael. The youngest sibling, Rose, has promised Michael not to let his true love marry anyone else in his absence. Luckily, Rose's teacher has informed her that there is a point in the ceremony where the umpire says: Anyone got any problems before I go ahead? McKay's brilliance is in her characterization. As the narrative viewpoint shifts, each character is unique, charming, and entirely likable. The depth of the story is conveyed in the dynamic of this family that is at times both touching and hilarious. Beautifully crafted descriptive language makes this offering a real gem. It does not stand alone, however, as previous knowledge of the characters and the story line is required.Rebecca Stine, The Ferguson Library, Stamford, CT Copyright Reed Business Information, a division of Reed Elsevier Inc. All rights reserved.Gr. 6-9. McKay's fourth novel about the Casson family begins with every child's nightmare: while listening to a ghost story at school, nine-year-old Rose wets herself. Once again, McKay creates a sly, jovial portrait of an English family that pitches toward minor disasters only to be rescued by its own loving, eccentric members. Narrated in the voices of the three youngest Cassons (Rose, Indigo, and Saffron), whose passages sometimes employ lists and appendixes, the novel is more fragmented than its predecessors, and readers meeting the Cassons for the first time may wish for more background. Despite that, the crowd of voices echoes a large family, with each person trying to be heard, and the dramas, from older sister Caddy's engagement to Rose's thrilling discovery of ""a flying feeling,"" are as wild and endearing as ever. Readers will also delight in the precise, human details, narrated by children who miss nothing: ""Tired people cannot learn,"" says Rose's teacher as she dumps a handful of markers into her full coffee cup. Another charmer for Casson fans. Gillian EngbergCopyright American Library Association. All rights reserved; Title: Caddy Ever After (Casson Family)",2,47435,"[27978, 28270, 47645, 51522]"
Growing Up & Facts of Life,"Description: Mixing the true and the truly wild, Jason Chin offers up engaging facts about the towering trees of California and Oregon along with bright, captivating illustrations that pluck a kid out of New York City and plunge him into the redwood forest. The Washington PostThe story in the illustrations shows in lovely metaphor how a tiny seed of information can take root in a fertile mind and grow into a strong, fire- and disease-resistant, redwood-sized understanding. Los Angeles TimesThis eco-friendly introduction to our state tree relies on straightforward writing for the facts and soft-edged art for a fanciful perspective. San Francisco ChronicleChin packs a great deal of information into his succinct text, and the blend of fantasy and realism in his watercolors will charm readers. Science magazine* Chin's watercolor illustrations capture both the majesty of the redwoods and the young boy's inquisitive personality, and while the idea of a storybook so vivid that it comes to life is not new, what sets this one apart is that Chin has paired his fantastical visual narrative with a straightforward nonfiction text. The Horn Book, starred review* The straightforward narrative is given enormous energy by the inventive format and realistic watercolor illustrations--their soft edges and muted hues suit the mist-shrouded giants. Chin adeptly captures the singular and spectacular nature of redwoods in this smartly layered book. Publishers Weekly, starred review* A real eye-opener. . . . The text clearly and succinctly presents information, which is effectively illustrated in the colorful paintings. Even better, the narrative element in the artwork soars, promising to engage children imaginatively as well as intellectually. Booklist, starred reviewThe dazzling watercolors create an ingenious journey to highlight the facts. The Cleveland Plain DealerThis inventive story will charm and educate readers and send their imaginations soaring. School Library JournalAn inventive, eye-opening adventure. Kirkus ReviewsA straightforward and informative text about coastal redwoods captions pictures that tell not exactly a different story, but one whose metafictional cheek will draw readers in--just as the book's hero is drawn, by his imagination, high into the redwood canopy. Science and story are seamlessly pulled together in neatly crafted paintings. The Horn Book, a Fanfare 2009 bookJASON CHIN worked as a children's bookseller. He has illustrated several books, but Redwoods is his author-illustrator debut. He lives in Vermont.; Title: Redwoods",2,45694,"[3736, 3995, 4121, 4784, 4826, 6098, 7373, 7654, 10870, 10902, 11222, 12851, 19035, 19404, 22876, 23334, 23783, 25657, 27886, 31869, 32437, 33656, 33731, 33892, 35414, 36570, 36620, 37967, 42602, 45286, 45727, 45729, 45806, 48242, 49080, 51368, 51876, 52410, 52608, 52649, 53256, 54481, 61092, 61164, 61974, 62252, 62280, 62293, 62454, 62709, 62869, 65089, 65102, 65131, 65171, 65174, 65178, 67340, 68107, 68188, 68192, 68210, 68894, 70581, 71086, 71778, 73154, 74080, 74561, 74965]"
Growing Up & Facts of Life,"Description: A little one hunts for a missing sock. This quick board book loosely details the hunt for a missing red sock, but the real goal is expanding nascent vocal skills. A note for parents on the opening pages details the importance of constantly talking to babies, even when they can't respond. By listening to a constant narration of the day's activities, little ones will soak in all sorts of meanings, tones, and conversational patterns. The actual story's text consists entirely of a mother's narration of her laundry duties preparatory to a trip to the park. The mom and child pictured are Asian-American, and both are clearly delighted with each other; the baby's giggling is almost audible. This is a book best read to the youngest of readers, as it's designed for parents of babies that are barely cooing. A similar title, A Fish to Feed, goes one step up the developmental ladder and is aimed at those who can say a few words but not much else. A sweet story that instructs parents as well as delighting babies. --Kirkus Reviews Ellen Mayer is a writer and early literacy home visitor who helps families support their children's language development through books and play. She has a M.Phil. in Sociology and worked as a researcher at Harvard's Graduate School of Education, studying family engagement in education.; Title: Medias Rojas / Red Socks (Spanish/English) (Spanish Edition) (Spanish and English Edition)",2,64856,"[5373, 9850, 10924, 52894, 52899, 61648, 64882, 64883, 74124]"
Animals,"Description: Author-illustrators Agnese Baruzzi and Sandro Natalini met while studying in Urbino, Italy. They have gone on to illustrate a number of childrens books, working both individually and together.; Title: The True Story of Little Red Riding Hood: A Novelty Book",1,32832,[32456]
"Activities, Crafts & Games","Description: PreSchool-KThis simple story takes children on an evenly paced cross-country tour. While playing with his toy, a boy imagines heading off for adventure in a life-size rig. With horn blasting and engine roaring, he sets off through the city, over a bridge, into the country, across a valley, up a mountain, through a tunnel before taking a doughnut break at a truck stop. After munching on his snack, the youngster climbs back into the cab. He continues onward, rolling across a desert, over mountains, across plains, through a forest, and on to the sea. At a harbor, the child unloads his cargo. He quickly returns to reality when his dad calls him for dinner. Minimal text appears on each page. Garofoli's bright spreads, rendered in Adobe illustrator, convey the essence of each geographic locale and extend the short text. The bouncy book jacket depicting the semi rolling across a quilted bedspread will entice youngsters with an interest in trucks. London fans will be looking for this title to accompany A Truck Goes Rattley-Bumpa (Holt, 2005).Lynn K. Vanca, Akron-Summit County Public Library, Richfield, OH Copyright Reed Business Information, a division of Reed Elsevier Inc. All rights reserved.A boy's toy yellow truck revs up his imagination and inspires a daydream of driving an 18-wheeler across the country. After rolling across a bridge, through a valley, and over a mountain, he pulls into a truck stop for doughnuts before hitting the road again. Across desert and prairie, through forests, and down to the sea, the truck barrels along until it arrives harborside, where its cargo is loaded onto ships. And just in time, too, because the boy's father is calling him for dinner. Argentine artist Garofoli contributes a fine series of digitally assisted illustrations, featuring clean lines, fresh colors, and varied compositions. West to East, left to right, page after page, the truck rolls along through the wide double-page spreads. Neatly capturing the easy way in which children slip from playing around to playing intently, this motor-minded fantasy would be a good book to share before a road trip. Carolyn PhelanCopyright American Library Association. All rights reserved; Title: My Big Rig",6,31779,"[6228, 31919, 31927, 49195, 58874]"
Growing Up & Facts of Life,"Description: Read and find out about one of nature's most mysterious forcesthe earthquake. Some earthquakes are so small that you don't even feel them, while others can make even big buildings shake! Learn why earthquakes happen, where they are most likely to occur, and what to do if one happens near you.Franklyn M. Branley was the originator of the Let's-Read-and-Find-Out Science series and the author of close to 150 popular books about scientific topics for young readers of all ages. He was Astronomer Emeritus and former Chairman of the American Museum of Natural History-Hayden Planetarium.; Title: Earthquakes (Let's-Read-and-Find-Out Science 2)",2,4021,"[617, 1686, 1997, 2263, 3736, 3777, 3791, 3809, 3990, 3995, 3996, 3998, 3999, 4002, 4005, 4007, 4011, 4013, 4016, 4017, 4018, 4020, 4025, 4030, 4686, 4719, 4750, 4753, 4766, 4772, 4784, 4800, 4802, 4809, 4817, 4818, 4821, 4833, 4907, 4923, 6240, 7347, 13079, 24454, 25041, 26490, 26540, 26997, 27236, 35988, 39141, 39143, 39399, 40851, 46701, 48149, 49595, 53655, 65169]"
