category,text,label,node_id,neighbour
Literature & Fiction,"Description: Grade 25This hilarious collection of poems about food stretches the imagination and vocabulary. Young picky eaters are confronted in the title poem with the possibility that ""If cotton candy, apple pie,/And French fries looked at you/And said, 'Gross! Blecchh! Nope, I won't try./I'll never like it. Ew!'"" kids would say, ""'Hey! That's no fair!/Give me a chance!'"" Varying in length and form (four lines to a sonnet to a two-page poem), the poetry is fresh, funny, and challenging, including words like ""pernicious,"" ""prehensile,"" ""unminced,"" and ""blanched."" Full-color and sometimes delightfully bizarre mixed-media illustrations offer clever asides (""Nuts!"" declares a nut, and ""Pea brain"" announces a pea), goofy perspectives (from inside a mouth, for example), and amusing visual scenarios. In ""Mom,"" readers might laugh out loud at the re-created scene from Goodnight, Moon, this one featuring praying mantids: ""I ate your father. Yes, it's true./That's what we praying mantids do./His last words to me were 'Adieu./If only I could eat you, too.'"" This is a winner that kids will love.Lee Bock, Glenbrook Elementary School, Pulaski, WI Copyright Reed Business Information, a division of Reed Elsevier Inc. All rights reserved.Some of the most memorable poems in Shel Silversteins Where the Sidewalk Ends (1974)centereduponfoodwho doesnt rememberSarah Cynthia Sylvia Stout and herleaning towerof trash?Weinstock borrows the food theme as well as Silversteins tone and cooks up 19 poems about the stuff we shove into our mouths (the table of contents literally places the poem titles inside a stomach). The stanzas, which vary fromshort- to medium-length, are mischievous andclever(sweet-flavored meats is rhymed with meat-flavored sweets). The titular centerpiece poem imagines a world in which food hates us, too: That Trudys gross out rainbow trout, / And Rachels skeeve out schmaltz? / That Tommys make pastramis pout, / And sardines cringe at Walts? The art also follows the Silverstein mold, eschewing cute drawings in favor of grotesque, ghastly, or disconcerting representations of children and animals. Theres a prevailing sinister undercurrent (the poem Mom begins with the line I ate your father), but that will likely only add to its appeal. Grades 1-3. --Daniel Kraus; Title: Food Hates You, Too and Other Poems",0,48995,[7515]
Growing Up & Facts of Life,"Description: Erainna was born and raised in central Louisiana. The oldest of five children she always yearned to be a teacher and forced her siblings to play school year round. Naturally, she graduated with a teaching degree in 1995 and earned her Master's degree in 2000. Five years later she earned her Education Specialist degree in early childhood education. After fifteen years in the classroom, she moved to the role of school counselor and has never been happier. While serving as school counselor at an elementary school in northeast Texas, she frequently uses children's books as therapy to help her students heal, learn and grow. Ideas for her books come from the students she works with on a daily basis. Her goal, as an author, is to touch the hearts of children, one story at a time. Erainna has written over thirty books designed to guide parents, teachers, and counselors as they help children to become their best self. Erainna lives on a 300 acre cattle ranch near the Red River with her husband, two daughters, three dogs, two horses, and one ill-tempered cat.; Title: Friendship Tug-of-War (GIRL POWER: Believe in Yourself)",2,24824,[24820]
Education & Reference,"Description: McGraw-Hill authors represent the leading experts in their fields and are dedicated to improving the lives, careers, and interests of readers worldwide; Title: Math, Course 3, Vol. 1 (Common Core Edition) (MATH APPLIC &amp; CONN CRSE)",12,5076,"[212, 214, 218, 219, 11783, 11785, 17212, 23152, 31245, 42867, 55674]"
Religions,"Description: Illustrated in full color. Jonah goes overboard at sea, gets swallowed by a whale, is released, and finally delivers God's message to the people of Nineveh.; Title: Jonah and the Whale (A Chunky Book(R))",20,26342,[26275]
Growing Up & Facts of Life,"Description: Ethan Long is the author of Tickle the Duck and Stop Kissing Me and has illustrated a number of other children's books including Stinky Smelly Feet by Margie Palatini, and more recently, One Little Chicken by David Elliott, Fiesta Fiasco by Ann Whitford Paul, and The Zombie Nite Caf by Merrily Kutner. He can be found on the web at www.ethanlong.com.; Title: Have You Been Naughty or Nice?",2,10280,"[10225, 10227, 10286]"
Growing Up & Facts of Life,"Description: Betty G. Birney has won many awards for writing for television, including an Emmy, three Humanitas Prizes, and a Writers Guild of America Award, and she won the Christopher Award for&#160;Friendship According to Humphrey. In addition to the Humphrey series, she is the author of&#160;The Seven Wonders of Sassafrass Springs&#160;and&#160;The Princess and the Peabody's. She grew up in St. Louis, Missouri, where her parents grew up as neighbors on Humphrey Street. Her website, bettybirney.com, is full of fun Humphrey activities and information.; Title: School Days According to Humphrey",2,6529,"[541, 2425, 3354, 5334, 6058, 6146, 6289, 6338, 6527, 6588, 6665, 6708, 6791, 6801, 6855, 6868, 6871, 6874, 6892, 6902, 6917, 6932, 6951, 6981, 7721, 10686, 11397, 12819, 13263, 14339, 16617, 17809, 18145, 18183, 18455, 22104, 22727, 22883, 23002, 23040, 24710, 32564, 34497, 45771, 48359, 49800, 58174, 70479]"
History,"Description: Gr 46This illuminating book covers the life and career of Nellie Bly (18641922) as well as profiling other reform-minded journalists, including Jacob Riis, Ida B. Wells, and Upton Sinclair. Mahoney's descriptive writing informs without overwhelming. Excerpts from the writings of the journalists are woven into the book, offering a taste of the vivid, sensationalized text characteristic of the muckraking genre. Readers will get a rich sense of the late 19th and early 20th centuries, when mentally ill patients endured abuse, racial and gender prejudices were flagrant, and many suffered through dire poverty. A dozen activities scattered throughout the text are weak additions, lacking strong relational ties to the content. For instance, the Ida Tarbell chapter includes information on making yogurt parfait because ""if [Tarbell] did splurge for a treat, she may have had a delicious dessert called a parfait."" The vivid illustrations consist of period photos and ephemera. VERDICT A worthy purchase.Jennifer Prince, Buncombe County Public Libraries, NC&ldquo;What an engaging concept! Not only is this book very informative about Nellie Bly and other investigative journalists, but the activities are extremely engaging and complement the well-researched narrative. It&rsquo;s not hard to imagine a new generation of muckrakers being inspired by these pages.&rdquo; &mdash;Arthur &ldquo;Tri&rdquo; Fritz, editor, The Nellie Bly Collection, and creator, nellieblyonline.com&ldquo;An engaging book with very rich stories about the early muckrakers who helped to define journalism as a public service. Ellen Mahoney&rsquo;s storytelling approach is perfect for young readers, and each chapter unfolds as an adventure.&rdquo; &mdash;Suzanne Lysak, assistant professor, broadcast and digital journalism, Syracuse University Newhouse School of Public Communications&quot;This outstanding work of nonfiction is sure to inspire a new generation of investigative journalists.&quot; &mdash;Teacher Librarian&ldquo;With excellent content, an appealing layout, and an exciting topic, this book is a joy to read and explore.&rdquo; &mdash;Booklist; Title: Nellie Bly and Investigative Journalism for Kids: Mighty Muckrakers from the Golden Age to Today, with 21 Activities (For Kids series)",18,67182,"[6798, 13501, 18978, 49476, 49546, 53272, 59958, 60377, 68560]"
"Activities, Crafts & Games","Description: Born in Hong Kong and raised in Philadelphia, Jannie Ho studied illustration at Parsons School of Design in New York. Also known as Chicken Girl, Jannie has been drawing ever since she can remember. Now she creates humorous illustrations for books and magazines. Much of her work and style has been inspired by Japanese and retro art. Her books include The Haunted Ghoul Bus (Sterling, 2008), written by Lisa Trumbauer, The Mixed-Up Alphabet (Scholastic, 2007), written by Steve Metzger, and The Penguins' Perfect Picnic (Innovative Kids, 2007), written by Trish Rabe.; Title: Mudpuppy 10-Foot by Air by Land by Sea Coloring Roll Continuous Coloring Paper, Great for Group Coloring, Ages 3+",6,29321,"[31172, 31321, 48586, 48682, 52378, 52592, 58226]"
Science Fiction & Fantasy,"Description: Adam Blade is the author of the Beast Quest series, which includes Cypher the Mountain Giant,Ferno the Fire Dragon, and Sepron the Sea Serpent.; Title: The Complete Book of Beasts (Beast Quest)",7,47115,"[47093, 47135]"
"Science, Nature & How It Works","Description: Grade 3-6-Ashley Landon and her brother, Jack, are out for a day of fishing in the Florida Everglades with Bridger Conley, the latest in a series of foster children taken in by their parents. The three youngsters catch more than fish when Jack decides to take some photos. His camera is stolen by a stranger in a powerboat, but it isn't until later that Jack realizes that the culprit was really after his film. In their quest to find the thief, the three sleuths also solve the mystery of why the manatees are dying. Vivid descriptions and cliff-hanger chapter endings with plenty of action in between hold readers' attention, and the authors skillfully weave in facts about the ecology and wildlife of the Everglades. The endpapers feature a map of Everglades National Park with brief data about it, and students are invited to send research questions or other messages to both authors through their e-mail addresses. Readers will delight in the close-up shots of some of the animals described in the story featured on four pages of National Geographic quality photos tipped in the center of the book. Pair this title, the fourth about this family, with another well-written ecological mystery set in the Everglades, Jean Craighead George's The Missing 'Gator of Gumbo Limbo (HarperCollins, 1992). A commendable and timely title.Linda L. Plevak, Alamo Area Library System, San Antonio, TX Copyright 1999 Reed Business Information, Inc.; Title: Deadly Waters (National Park's Mysteries Series, 4)",15,35461,"[35442, 49459]"
Animals,"Description: This will be a holiday favorite for bedtime story requests and early readers for many years.By ShelleLPLoooong Dog Sees his first snowfall and goes on adventures with his owner and her neighbors. Vibrant full-page illustrations will keep children and adults entranced as they watch the pup make snow angels, try to ice skate and even meet Santa. Told in rhyme, his escapade will have kids falling asleep right alongside him at the end of the day. This will be a holiday favorite for bedtime story requests and early readers for many years.White Christmas is just the latest adventure for Loooong Dog. Previous books include a trip to the neighborhood park to hang with the local kids and other pets as well as to play in a rainstorm inShort Adventures of a loooong Dog and Trick or Treating in his neighborhood during Halloween in his costume inHalloween Loooong DogThrilling adventuresByT. B.I would like to thank the author for the series of those nice books about the Looong dog. My son cannot wait for another story as he liked reading about new and new adventures. I got this book for him now, so we can read it together in front of the Christmas tree in a couple of weeks. Such nice pictures included and the language is easy and understandable for kids, so 5 stars!LovelyByOlgaGoaI really enjoyed this book. I wanted to read something really Christmas forcomingholidays and it got my attention!Children books are really awesome because I can enjoy as graphic, as poems.I would advise this book to my friends for their kids.5 stars!For this funny Long Dog, it&apos;s the First the most wonderful time of the year!; Title: White Christmas of a Loooong Dog: Beautifully Illustrated Christmas Poems for Kids and Dog Lovers (Loooong Dog's Adventures) (Volume 3)",1,75721,"[674, 2937, 4379, 5494, 9006, 9443, 9655, 11210, 11930, 12211, 13001, 14412, 16187, 16501, 16726, 18426, 18517, 19616, 21500, 28496, 28843, 31707, 44920, 45333, 45649, 45727, 46013, 49414, 51105, 52560, 55024, 55262, 56433, 58059, 63066, 63375, 69398, 69403, 69442, 69452, 69484, 69490, 75708]"
Action & Adventure,"Description: Edward Ardizzone was the eldest of five children. In 1905 his family moved to Ipswich, where he learnt to know and love the little coastal steamers that he was to draw so often in the Little Tim books. Illustrator of more than 170 much-loved children's books, Edward Ardizzone was awarded the Kate Greenaway Medal in 1956 and the CBE in 1971. He died in 1979.Stephen Fry is a national treasure and was born in 1957 in London and brought up in Norfolk.Memorable television appearances included Blackadder, A Bit of Fry &amp; Laurie and Jeeves and Wooster. Big screen outings included Wilde, Gosford Park and Peter's Friends. He also read all of the Harry Potter books for the unabridged audiobook edtions.; Title: Tim in Danger (Little Tim)",10,71381,"[7996, 60981, 71357, 71359, 71373, 71808]"
Growing Up & Facts of Life,"Description: Jesse Franklin was raised in the small, high desert town of Green River, in southwest Wyoming. Growing up, he spent most of his free time exploring the beautiful expanses of his home state. Following high school, he enlisted in the Marine Corps and was stationed at Camp Pendleton, California. After reaching the rank of sergeant, he was selected for an enlisted-to-officer program in which he studied at the University of Utah. He was commissioned, became an infantry officer, and was subsequently stationed at Camp Lejeune, North Carolina. He met his wife during a deployment to Okinawa, Japan, where she was serving as a Navy nurse. Today, Jesse continues to serve as a Marine officer and he and his wife have been blessed with three wonderful children. Jesses stories are inspired by his family, his experiences in the Marine Corps, and the wonderful people with whom he has served.; Title: My Daddy Sleeps Everywhere",2,74768,"[20993, 22393, 22903, 24740, 31892, 43057, 43794, 45020, 50062, 51653, 54098, 64122, 67707, 68475, 70173, 73956, 74052, 74403, 74674, 74678, 75574]"
Education & Reference,"Description: This will be of tremendous value to adults who teach writing to children, but it will also appeal to Nixons legion of fans. . . . A delightful look back at a time and a life.BooklistClear and concise advice to writers.School Library JournalMany of Joan Lowery Nixon?s readers have written to her to ask how they, too, can become published writers someday. This memoir, including anecdotes and advice, is her answer to them. From her first publication at age ten?a poem entitled ?Springtime? in a children?s magazine?to her graduation from Hollywood High during World War II, Joan Lowery Nixon shares the events from her childhood that helped her to grow and develop as a writer. Joan Lowery Nixon took to heart and never forgot what her ninth-grade journalism teacher told her, ?A writer must always have faith in herself. If you don?t believe in yourself, no one else will.? Both informative and entertaining, The Making of a Writer is a charming look at one writer?s beginnings.; Title: The Making of a Writer",12,18178,[]
Growing Up & Facts of Life,"Description: Youngsters learn to identify 8 common members of the insect world as they color images of a fuzzy caterpillar, spider, ant, bumblebee, grasshopper, butterfly, 2 others.Includes 8 images to colorDimensions: 4 3/16 x 5 5/8Pages:8Coloring Book; Title: Insects Stained Glass Coloring Book (Dover Stained Glass Coloring Book)",2,19914,"[19835, 19862, 19873, 19874, 19881, 19888, 19898, 19903, 19904, 19917, 19921, 19954, 19963, 20064, 20080, 20171]"
Growing Up & Facts of Life,Description: 2016 Mattel. All Rights Reserved.; Title: Ever After High: Epic Winter: The Junior Novel,2,11331,"[11007, 11032, 11054, 11069, 11106, 11141, 11171, 11183, 11188, 11196, 11200, 11208, 11280, 11306, 11307, 11313, 11375, 11388, 11410, 11412, 11445, 11450, 11454, 11456, 11457, 11467, 11468, 11535, 11552, 11554, 11559, 11587]"
Animals,Description: MacKenzie Buckley is the author of the middle-grade fantasy novel Sally's Bones and co-author of the upcoming young reader series Marvel's Super Hero Adventures. She is a trained dramaturge and former editor for Marvel comics. She lives in New York with her family and has at least one totally crazy dream a week.; Title: PAW Patrol: Pup-tastic Halloween: A Spooky Lift-the-Flap Book,1,35603,"[2192, 3336, 6735, 10041, 13367, 13536, 14632, 16724, 16741, 16795, 16812, 16846, 18431, 18738, 19597, 21706, 22077, 23675, 23726, 23741, 23761, 23797, 23867, 23884, 23933, 23971, 24023, 26430, 33940, 35593, 45285, 45347, 48956, 53323, 54480, 58091, 58138, 58207, 58208, 58212, 58228, 58239, 58509, 60744, 69420, 69423, 69460]"
Education & Reference,Description: Book by GREAT SOURCE; Title: Write Away: A Handbook for Young Writers and Learners,12,25569,"[25560, 25565, 25570, 25571, 42523]"
Literature & Fiction,"Description: Gr. PreK-1 Though Mary Had a Little Lamb was published in 1830, it seems anything but old-fashioned in this jaunty picture book. Yes, the illustrations feature a one-room schoolhouse out in the country, but the characters clothing and the many touches of fantasy and humor lift the poem out of its historical period and into some timeless, lighthearted landscape of the imagination. All six verses appear, from the very familiar to the nearly forgotten, and each illustrated with one or more double-page pictures that magnify the hilarity in the schoolhouse when the lamb shows off for the class, the sadness that the lamb and Mary feel when he is turned away, and the joy of their reunion. Even the potentially unctuous-sounding ending verse is lightened by the joyous spirit and amusing details in the accompanying illustrations, digital collages combining fabric elements with acrylic and gouache painting. A child-pleasing version of the well-known poem. --Booklist, March 15, 2011Author Sara Josepha Hale is deceased. Hale was an American writer and editor. Published in 1803, Mary Had a Little Lamb was part of a collection of poems for children. Illustrator Laura Huliska-Beith lives in Kansas City, Missouri, with her husband Jeff and their three dogs. ; Title: Mary Had a Little Lamb",0,31887,"[10339, 28634, 31239, 62253]"
Education & Reference,"Description: ""Immensely enjoyable""--ForeWord Clarion Reviews""For children who enjoy lingering over pages full of magical creatures and whimsical details [...] told in simple and engaging words and imaginative pictures.""--Kirkus Reviews""Enchanting""--Eselsohr, Fachzeitschrift fr Kinder- und Jugendmedien""Recommended reading for all parents and kindergarten teachers""--Oesterreichisches Schulportal""Readers will emerge from this book feeling slightly more confident about themselves--whatever their size.""--ForeWord Clarion ReviewsAm I small? is the world's first World Children's Book - available for every country on earth in at least one official language.; Title: Am I small? / Jega jagnayo?: Children's Picture Book (Korean and English Edition)",12,56592,"[5862, 22961, 29382, 36670, 36688, 36692, 36700, 36702, 36712, 36714, 36715, 36716, 39611, 54421, 56582, 56584, 56588, 56890, 58449, 64884, 68994, 71141, 71154]"
Animals,"Description: Sea Searchers Handbook is a treasury of information, activities and illustrations designed to help young people know, love and take care of the sea. For all of you teachers wondering how to better teach an ocean unit, dont pass up this wonderful book. -- Science and Children; Title: Sea Searcher's Handbook: Activities from the Monterey Bay Aquarium",1,72166,[74234]
Animals,"Description: Nancy Rose is a photographer living in Canada. Her popular photos of wild squirrels in handcrafted settings, taken in her backyard, have attracted a wide following on Flickr, and have been featured in the Washington Post, the London Times, and Buzzfeed, among many others. She is the author of The Secret Life of Squirrels and Merry Christmas, Squirrels!; Title: The Secret Life of Squirrels: A Love Story",1,11096,"[148, 2475, 4204, 6222, 11210, 11366, 11397, 11400, 15870, 21596, 21616, 21630, 21762, 24227, 28843, 29305, 33950, 36637, 37850, 44920, 49776, 51694, 52602, 55395, 56396, 57448, 59665, 68474, 74276]"
"Science, Nature & How It Works","Description: After reading this book, your kids will NEVER want to come inside ever again. Not only does Colleen Kessler capture the heart of your children with her child-centered language, she will also encourage them to think outside the box, stretch their thinking and dig into their inner curiosities through her captivating science-based activities.Dayna Abraham, author of The Superkids Activity Guide to Conquering Every Day and Sensory Processing 101, founder of Lemon Lime AdventuresThis is such an engaging book. Full of interesting experiments and projects, it takes your childs natural curiosity for the bugs in their backyard and inspires them to wonder, explore and discover so much about the world.Cathy James, author of The Garden Classroom, founder of NurtureStoreTelling your kids to go outside and play just got a heck of a lot more educational. Colleen Kessler is an expert educator who understands how to make outside activities spark interest in science without stripping away the fun.Allison McDonald, B.Ed, author of Raising A Rock-Star Reader, founder of No Time for FlashcardsNature is the worlds greatest classroom, and this book makes it easy to explore and totally fun. Perfect for parents and teachers alike!Anne Carey, author and founding engineer of Left Brain Craft BrainColleen Kessler is an award-winning educator, author, speaker, homeschool mom to four gifted children and the founder of Raising Lifelong Learners. She left teaching after more than a decade to write and speak as an advocate for gifted and twice-exceptional children. Shes written more than a dozen books, including Raising Creative Kids and Hands-On Ecology. She speaks regularly at homeschooling conventions, events and online webinars and podcasts. Colleen lives with her family in Ohio.; Title: 100 Backyard Activities That Are the Dirtiest, Coolest, Creepy-Crawliest Ever!: Become an Expert on Bugs, Beetles, Worms, Frogs, Snakes, Birds, Plants and More",15,68018,"[4407, 5350, 14293, 29158, 32469, 33443, 33933, 38695, 39143, 40747, 41376, 45204, 45653, 49750, 53326, 64258, 67085, 68016, 68017, 68019, 68878, 68882, 70806, 71796, 71982, 73778, 73782, 74897, 75155, 75196, 75210]"
