category,text,label,node_id,neighbour
Literature & Fiction,"Description: Elizabeth Yates has been well loved by thousands of readers, and many of her compelling books for young people are being reprinted so a new generation may enjoy them. She has received many distinguished awards, most notable of which is the Newbery Medal for Amos Fortune, Free Man.; Title: The Next Fine Day",0,41913,"[4400, 4424, 5238, 5241, 5995, 7462, 14203, 17932, 24609, 24831, 27457, 27812, 38719, 40071, 41895, 41916, 42645, 61802, 61822, 72397]"
Literature & Fiction,"Description: Ada Hopper has been extremely inventive ever since she was little. There was nothing that a rubber band and some tweezers couldnt fix, no question that couldnt be answered by scouring the library, and no way she wasnt escaping over that back yard fence! Ada loves reading and writing because of all the fantastical worlds a good book can bring you to. When not working, Ada enjoys karaoke, spending time with her family, and going on the occasional adventure or two.Robots Rule the School ; Title: Robots Rule the School (The DATA Set)",0,55258,"[2317, 18993, 19081, 22609, 22727, 22758, 22764, 22883, 22885, 22905, 45738, 45922, 45937, 45962, 51542, 51817, 52026, 54541, 55084, 55088, 55201, 55207, 55305, 55439, 55448, 55482, 55484, 55503, 55505, 55560, 57467, 57506, 68077, 68115, 75198, 75200, 75201, 75203]"
"Arts, Music & Photography","Description: Michael Bierut is cofounder of the website Design Observer and teaches design at the Yale School of Art.Cooper Hewitt, Smithsonian Design Museum is the only museum in the U.S. devoted exclusively to historic and contemporary design.John Lasseter is an Academy Awardwinning director and chief creative officer at Walt Disney and Pixar Animation Studios.; Title: Designing with Pixar: 45 Activities to Create Your Own Characters, Worlds, and Stories",13,52655,"[33376, 35015, 60258, 65688, 65727, 68164, 69122, 74363]"
Humor,"Description: Against abundant white backgrounds, bold illustrations portray the characters and goofy activity of the popular folk song. Ages 4-8. Copyright 1991 Reed Business Information, Inc.; Title: I Know an Old Lady Who Swallowed a Fly",3,39045,[11754]
Growing Up & Facts of Life,"Description: PreS-Gr 2A bright and cheery girl and her grandfather spend a morning teaching each other tai chi and yoga in this sweet, intergenerational picture book. Mei Mei, an adorable girl with pigtails and flair, is curious about the slow dancing that Gong Gong does. She is determined to replicate his actions but instead bursts with energy, creating her own bouncing movements. Mei Mei decides to teach Gong Gong the yoga poses that she learned in school, but his elderly body cannot twist and turn as agilely as hers. In the end, they each assure the other that their movements are ""perfect,"" sending a sweet message that it is the process and the practice that are important. Digitally rendered illustrations place Mei Mei and Gong Gong in a lush backyard garden filled with sunflowers, red maple leaves, and dragonflies. While the background images are repetitive, the focus of the illustrations is on the intergenerational pair. Mei Mei's face expresses a full range of emotions, while Gong Gong's is somewhat one-note. The text is brimming with similes and metaphors describing their movements, and the words follow the actions, with the letters in words such as arched and stretched curving and bending on the page. Descriptions of the movements do not overwhelm the story, and a full set of instructions for the poses, as well as discussions of the practices, are included as back matter. VERDICT This selection stands out from other yoga picture books for its introduction to tai chi and will circulate well in collections where there is an interest in movement, health, and fitness activities.Clara Hendricks, Cambridge Public Library, MAIn a charming outing from newcomer Liu, which won the publisher s 2013 New Voices Award, a girl named Mei Mei gets a backyard tai chi lesson from her grandfather. Gong Gong s movements are graceful and calm, but Mei Mei has a more raucous approach: during the Play the Lute pose, Gong Gong is a musician serenading the sunflowers. Mei Mei [is] a rock star playing guitar for the daisies. Then Mei Mei steps into the teaching role, walking Gong Gong through a few yoga poses. Forshay s polished digital art lends both characters distinctive and contrasting personalities. Closing instructions highlight the tai chi and yoga poses discussed, but the book s sweetness stems from the thoughtful gentleness with which Gong Gong guides Mei Mei, never restraining her natural exuberance. --Publishers Weekly; Title: A Morning with Grandpa",2,67633,"[4111, 4204, 6735, 6810, 9647, 10271, 10882, 11282, 15364, 15842, 16347, 20284, 21109, 21393, 21546, 21955, 22961, 24005, 25152, 27009, 28468, 29295, 29315, 32304, 33358, 33454, 33656, 33981, 34024, 36633, 39609, 39637, 41551, 42022, 45112, 48591, 52436, 52592, 52752, 52930, 53690, 54575, 54644, 55056, 55567, 55854, 55885, 55886, 55939, 57272, 57590, 58229, 58514, 59610, 59834, 61449, 62283, 62297, 65776, 65787, 65795, 65805, 67483, 67635, 68085, 68123, 68204, 68450, 68461, 70242, 70561, 72194, 72448, 72449, 73434, 74553]"
Growing Up & Facts of Life,"Description: Paul Galdone was born in Budapest, Hungary in 1907 and emigrated to the United States in 1928. After finishing his studies at the Art Student League and the New York School of Industrial Design, Mr. Galdone worked in the art department of a major publishing house. There he was introduced to the process of bookmaking, an activity that was soon to become his lifelong career. Before his death in 1986, Mr. Galdone illustrated almost three hundred books, many of which he himself wrote or retold. He is fondly remembered for his contemporary style, bright earthy humor, and action-filled illustrations, which will continue to delight for generations to come.; Title: The Teeny-Tiny Woman (Folk Tale Classics)",2,21692,"[2475, 4856, 5305, 5371, 5419, 5446, 8745, 9443, 9561, 10130, 10139, 10935, 13548, 15243, 15321, 15331, 15461, 15854, 17105, 21290, 21347, 21357, 21616, 21617, 21718, 22984, 23105, 23243, 23276, 23294, 23300, 24328, 26031, 27246, 32523, 33047, 33358, 37807, 39030, 39338, 40778, 42150, 42153, 44463, 51730, 51962, 52506, 68207, 75309]"
Growing Up & Facts of Life,"Description: ""Into her breezy prose and snappy dialogue, Namioka manages to insert thoughtful issues of acculturation and ethnic heritage . . . her deft use of humor serves as a wedge to open the door to cross-cultural difference.""--The New York Times Book ReviewThe delightful companion to the popular Yang the Youngest and His Terrible Ear and Yang the Third and Her Impossible Family.Yinglan Yang couldn't care less that her brother and sister have adopted all sorts of American customs. She misses China and doesn't want to fit in here. Her siblings decide that Yinglan needs help making friends in America. That's when they join forces and play matchmaker between Yinglan and Paul Eng, a Chinese American baseball player. They're certain Yinglan will never find out. Or will she?; Title: Yang the Second and Her Secret Admirers",2,18151,"[11638, 18102]"
"Science, Nature & How It Works","Description: ""With jaunty pictures that look striking from a distance, this farm-to-table picture book is a lively classroom read-aloud choice.""Booklist,starred review""Vivid colors, a multiracial cast, and seamless alliteration make this book a wonderful readnot once, not twice, but again and again.""Kirkus Reviews,starred reviewRUBIN PFEFFER is an author, agent, and veteran of the children's book industry.MIKE AUSTIN is an award-winning illustrator and graphic designer who lives in Seattle with his wife, illustrator Jing Jing Tsong, and their two kids. He spends most of his time creating illustrations for his clients or working on his children's books.; Title: Summer Supper",15,58085,"[10270, 12017, 16347, 16828, 21109, 22961, 29477, 33656, 45393, 45496, 45786, 45979, 49080, 52584, 55939, 58108, 68176, 68192, 68467, 70773]"
Growing Up & Facts of Life,"Description: Praise for Punk Farm: A Child Magazine Best Book of the Year A Texas Library Association 2X2 Reading List Book Wisconsins WEMTA Golden Archer Award Abilene ISD Mockingbird Award A Junior Library Guild Selection Michigans Mitten Award Nominee Tennessees Volunteer State Book Award Nominee Recommended by NY1, the Boston Globe, the Seattle Post-Intelligencer, the Wichita Eagle, and the Associated Press. Never have Old MacDonald and The Wheels on the Bus seemed so hip. NPR [set star] Laugh-out-loud funny. . . . Fans will definitely want a return engagement. Rock on! Kirkus, starred review Its a wild tale hipster kids will love. Scholastic Parent and Child Magazine The book is fearless in conception and execution, a jazzy comic bit of thievery and transformation. It does not look or sound or behave like your fathers old picture book. The Boston GlobeJarrett J. Krosoczka is the author and illustrator of Punk Farm, Peanut Butter and Jellyfish, and Baghead, among numerous other picture books, as well as the popular Lunch Lady graphic novel series. He lives with his family and a pug named Ralph Macchio in Northamption, Massachusetts. Find him online at studiojjk.com and @studiojjk.; Title: Naptastrophe!",2,15010,"[3076, 3090, 3107, 3118, 3898, 8648, 12086, 13115, 13471, 13478, 13744, 13795, 13874, 13887, 13931, 13976, 14026, 14056, 14063, 14967, 15004, 16913, 18109, 25711, 25737, 33997, 43897, 52619]"
Growing Up & Facts of Life,"Description: 5/5 Stars. ...I LOVED this story! It's a simple story, empowering, and Annie is endearing. While the story stands without the illustrations, artist Rachael Balsaitis...makes the story playful and shows Annie's independence. --San Francisco Book ReviewBeginning with the cataloging and dedication pages where we see Annie getting her favorite shirt out of the laundry basket, she is never without it. She is an active school-aged child, fully confident in her ungirly self-expression. But then her mom succumbs to gender expectations when they are invited to Uncle Benny's wedding. They go to the mall to get Annie's brother Albert a new suit and Annie a dress...The story ends happily as Annie comes up with an ingenious solution.Visually, the pages are uncluttered with lots of white space and just enough text. The watercolor illustrations by Rachael Balsaitis have a manga flavor that perfectly captures Annie's put-upon face...On the final page, the photos show the author and the illustrator in their own favorite plaid shirts, and even the end papers are plaid.This picture book affirms Annie's right to nonconformity in gender expression...It will appeal to all children and serve as a discussion starter about problem solving, social expectations and individuality. --Carolyn Caywood, American Library Association's GLBTRTANNIE'S PLAID SHIRT is about individual choices and one girl's struggle to be herself. The message, it is OK to be yourself, even if it's different! Written by a clinical psychologist, ANNIE'S PLAID SHIRT deals with gender identification in a positive and creative way, teaching tolerance and celebration of differences. --Midwest Book ReviewSTACY B. DAVIDS, Ph.D. is a licensed clinical psychologist and works as a school psychologist. She's also a former special education teacher. Her inspiration for writing Annie's Plaid Shirt came from feeling pressure throughout her life to conform to society's rules about gender. Even as a baby she reportedly yanked pink bows out of her hair. As an adult she says, does, and wears what she wants. Stacy lives in Miami, Florida. Just a few of her favorite things are cats, chocolate, and of course, plaid shirts. Learn more at stacybdavids.com.RACHAEL BALSAITIS is a professional plaid-wearer and illustrator, having illustrated the titles Annie's Plaid Shirt and Love is Forever. When she's not illustrating picture books she can be found reading the Sunday funnies, taking bike rides, and laughing at British comedies. Rachael lives in Minneapolis with her critters. Learn more at rachaelbalsaitis.com.; Title: Annie's Plaid Shirt",2,28628,"[4036, 4169, 4363, 10339, 10443, 11039, 11591, 12414, 16061, 16347, 16468, 16734, 19538, 21109, 22765, 23334, 23935, 28468, 32071, 33343, 33863, 33981, 36509, 36639, 36885, 37450, 37757, 42013, 42910, 42911, 44039, 45222, 48358, 48591, 50602, 50621, 50630, 52436, 52669, 56401, 57079, 57590, 58229, 58514, 59332, 59333, 59804, 59837, 62636, 62655, 62676, 62714, 62760, 64305, 66919, 66921, 67622, 67635, 70711, 71025, 72629, 74907, 75438]"
"Science, Nature & How It Works","Description: Ruth Strother is an award-winning writer and editor whose work has touched children around the globe. From running editorial departments at publishing houses to freelance writing and editing, Ruth has immersed herself in the creation of books for both children and adults. Her latest written works for children include W is for Woof: A Dog Alphabet and the NSTA/CBC Outstanding Science Trade Book for Children B is for Blue Planet: an Earth Science Alphabet. Ruth lives in Southern California with her husband, daughter, and two dogs.; Title: Smithsonian Young Explorers: Dinosaurs",15,68237,[68231]
Comics & Graphic Novels,"Description: Book by Tachikawa, Megumi; Title: Saint Tail, Book 7",22,73526,[72701]
Geography & Cultures,"Description: ""This is Hong Kong is resplendent with the little things that make Hong Kong one of the most magnificent cities in the world. This is Hong Kong will feed the soul of every travel-loving adult and child, the world over."" ~kids-bookreview.comM. Sasek was born in 1916 in Prague, Czechoslovakia. An author and illustrator, he is best remembered for his classic stories on the great cities of the world. He died in 1980.; Title: This is Hong Kong: A Children's Classic",11,35090,"[7193, 12706, 15811, 19002, 32824, 33293, 33333, 33443, 35081, 35083, 35084, 35085, 35088, 35089, 35092, 35093, 35094, 35096, 35097, 35101, 35102, 35107, 36715, 38603, 40583, 49387, 52524, 52617, 54897, 55183, 55468, 65218, 66166, 66169, 66170, 71789, 71795, 74738, 76472]"
Literature & Fiction,"Description: Susan Meddaugh was born and raised in Montclair, New Jersey. She graduated from Wheaton College, where she studied French literature and fine arts. After working briefly with an advertising agency in New York, she moved to Boston and worked at a publishing company for ten years, first as a designer, then art editor, and finally as art director. While there, she did the illustrations for Good Stones (Houghton Mifflin) by Anne Epstein, and then decided to strike out on her own as a freelance illustrator and creator of children's books. Since that time, Susan has written and illustrated many popular books for children, including Martha Speaks, which was chosen as a New York Times Best Illustrated Book for 1992. In 1998 she was awarded the New England Book Award, given by the New England Booksellers Association to recognize a body of work. Her work also was acknowledged with a New York Times Best Illustrated Award. She lives in Sherborn, Massachusetts.; Title: Martha habla: Martha hornea un pastel/Martha Speaks: Martha Bakes a Cake (Bilingual Reader) (English and Spanish Edition)",0,23250,[7651]
"Activities, Crafts & Games","Description: ""French-y and artistic, these cool board books will pique the interest of hip parents and their bbs."" - Real Simple; Title: The Game of Mix and Match (Game Of... (Phaidon))",6,29077,"[20282, 28983, 29064, 29065, 29068, 29069, 29070, 29072, 29080, 29082, 29084, 29091, 29094, 29098, 33451, 38603, 44463, 52524, 52584, 52622, 52632, 52663]"
Growing Up & Facts of Life,"Description: Make Believe Ideas, Ltd. is a publishing company focused on producing exciting, interactive books that both inspire and encourage children to learn and develop. Many of the Make Believe titles include sensory elements that are educational and playful.; Title: Let's Get Along Box Set",2,71111,"[4083, 10106, 10339, 10917, 10935, 11039, 11931, 11979, 15804, 21740, 22031, 23726, 28790, 32304, 41545, 44590, 52410, 55345, 58304, 64787, 68204, 68467, 74906, 75852]"
Literature & Fiction,"Description: Bonnie Bader has written several Penguin Young Readers. She lives in Brooklyn, New York.; Title: Ham-Ham-Hamsters (Penguin Young Readers, Level 2)",0,16607,"[3443, 5245, 5248, 5251, 5293, 5570, 5614, 5647, 5869, 6007, 6016, 6791, 12846, 13591, 16586, 18357, 18393, 18397, 18398, 18411, 18428, 18448, 18459, 18477, 18513, 18664, 18706, 18849, 18896, 18925, 18953, 18971, 18981, 19000, 19005, 19014, 19018, 19032, 19036, 19116, 19157, 19175, 19204, 19213, 19236, 19261, 19277, 19306, 19316, 19324, 19386, 19402, 19423, 19666, 20300, 20317, 20326, 35559, 49608, 50067, 50496, 54636, 55869, 67664, 70479]"
Animals,"Description: This story accurately portrays current political, economic and environmental issues in the Florida Keys: Cuban immigration, the culture of the working waterfront, greedy developers, the Key West Wildlife Center, mysterious incidents of maiming of pelicans - it's all there, from a teen's perspective. Plus parents, friendships, romance, high school social structure - things that every teen can relate to. A good read for all ages! -Ellen Westbrook, Florida Keys Audubon Society Board What a lively book and enjoyable read! Sometimes I found myself out of breath speeding with Kenzie and Angelo through the backcountry of the Florida Keys, hoping neither they nor I would run aground. In between the harrowing escapades, I learned much about pelicans, their fragility, habitat, and conservation. -Susan Nugent, PhD, environmental writer, professor of children's literature This book immerses the reader almost immediately as the characters become involved in finding solutions from one set of circumstances to another. This is a ""Murder She Wrote"" type of story line that has you guessing and re-evaluating the outcome with each chapter. -Sherian A. Wright, naturalist & author of ""Mason Bees for the Backyard Gardener"" Tangled Lines provides stunning, sometimes gut wrenching, visual images. The plot, setting, and characters are irresistible. I could hardly tear myself away! The convincing characters, each with their unique personalities and families have varying backgrounds: Kenzie a ""transplant"" from New York City, Angelo having grown up in the Keys with the family fish market, Harry carrying the attitude of his wealthy family - obsessed with investment and acquisition and completely detached from the well-being of the environment, and wheelchair-bound Ana, a local with an adorable Spanish accent who never sees herself as disabled. They, along with several other well- developed personalities, capture the character of the entire community. Furthermore, that this fiction eco-novel is based on thorough research of today's issues makes it deeply inspiring and eye- opening. -Wendy ""Big Bird"" Hawkins, Education Chair, Forsyth Audubon, Winston-Salem, NC; Title: Tangled Lines: Paradise in Peril",1,67243,[67238]
Animals,"Description: Gr 46Leo, a 13-year-old Singa (highly evolved lionlike creatures), tries hard to be like the other younglings; but not only is he scrawnier and weaker, he's also next in line to be the ruler of Singaramuch to the dismay of his elder cousin, Tamir. Leo also has a big secret: he's a Spinner. In a society that values science and reason above all else, those who spin tales and speak fiction are considered abominations and once found out are sent to live in exile where they could easily fall prey to the enemy Maguar. And Leo's Spinner abilities are even more unusual than most. The tales Leo is compelled to tell actually leave a physical trace behind; the creatures his tales are about appear in Singara, and it's no longer just Leo who can see them. When Leo's grandfather dies, Tamir makes his move to claim the throne and Leo's very life is in danger. Could Leo's ""fiction affliction"" be his saving grace or will it be his downfall? Laney's first book in the ""Pride Wars"" series draws on a number of familiar elementsrites of passage, a family battle for the throne, warring clansbut manages to make them feel fresh by adding unusual creatures and a well-developed history and belief system. Readers who like Erin Hunter's books will race through this title and will be highly anticipating the sequel. VERDICT A strongly developed anthropomorphized animal adventure. Recommended for school and public libraries.Heather Webb, Worthington Libraries, OH; Title: The Spinner Prince (Pride Wars)",1,45895,"[1844, 3589, 3793, 3814, 3905, 4039, 4090, 4327, 4329, 11041, 12013, 16627, 16918, 19642, 21637, 21724, 29296, 29298, 33972, 45866, 45968, 46003, 48649, 55960, 58071, 58101, 58157, 58193, 58200, 58288]"
Growing Up & Facts of Life,"Description: Harriet Morse has spent the last twelve years growing herself and studying life. What she has learned continues to help her every day. Harriet is married to a loving man named Michael, and they have three amazing girls: Jillian, Ella, and Lexie. Harriet and her family live in Huntington Woods and Chelsea, Michigan.; Title: Does This Make Me Beautiful?",2,73900,[67224]
"Science, Nature & How It Works","Description: Contents Living Outdoors Types of Camping Choosing Outdoor Gear Planning Your Trip Selecting a Campsite Setting up Camp Camp Chow Camp Skills Green Camping Packing List For More InformationSleeping in a SackCamping Activities for KidsCan you see the stars in the clear night sky?Can you smell the campfire burning?With this handbook, you'll find out how to choose a tent, fix a dutch-oven dinner, sing favorite camp songs, identify stars in the night sky, and lots more. So grab your hiking boots--and let's go camping!Also by Linda White, illustrated by Fran Lee:Cooking on a Stick: Campfire Recipes for Kids (Gibbs Smith 1996); Title: Sleeping In A Sack: Camping Activities for Kids (Gibbs Smith Jr. Activity)",15,41294,"[31209, 32089, 41293, 41297, 59909, 63472, 63475, 63478, 63479]"
